subject	date	incoherent	age	gender	edu	plancode	attribcode	beliefs	commentplan	commentattrib
S737098	26/October/2016	0	61	F	2	G	P	58	 I have always felt my best guess was pretty good not so today. I had to take a lot of steps  I tried to make my best guess as to which way to go.	I based them on what I thought would be the least amount of moves even if they got it right going a different route.
S738760	21/October/2016	0	62	M	5	P	P	93	 It was fun. Thanks! I went where I thought I could view the most area at one time. 	 If it was a good route to take
S748157	26/October/2016	0	25	M	6	G	?	76	 was quite a bit about luck!  It seemed like the red square was placed in inconvenient locations, so I tried them first.	whether they made the best &quot;meta&quot; decisions.  Didnt waste moves.
S74893	26/October/2016	0	23	M	3	P	?	100	 I tried to go to where more blocks would open up	 n/a I went with my gut feelings
S75262	26/October/2016	0	31	M	6	P	P	71	 I went where the most black blocks were.	 n/a If they went to an area with less black blocks to explore, I marked them with lower points. If they went to the same areas more than one time, I marked them low.
S76694	26/October/2016	0	40	M	3	G	P	17	 On of my favorite hits I've done so far, thank you.  It was mostly gut feeling, also the a little bit of the quickest way to uncover the most black squares.	based on wasted movement and whether or not I felt they could have uncovered more unknown squares with shorter moves.
S767416	21/October/2016	0	50	M	6	P	P	41	 I enjoyed it!  Thanks! Tried to decide to how minimize moves necessary to see all squares. 	 Thanks! Compared to least possible moves to solve.
S769114	26/October/2016	0	27	M	2	P	P	50	 This was actually quite fun.  I'd try to clear as many black squares as I could in as few moves as possible to try to ascertain the position of the red square.	 n/a I tried to evaluate how they made progress toward the goal. I ranked people who I thought tried to think about it logically higher than the ones who I believed were more random or put less thought into it.
S771420	26/October/2016	0	39	M	3	G	?	87	 I went with my gut instinct	 I went on my gut instinct on how well they performed
S773407	26/October/2016	0	27	F	6	P	P	100	 This was interesting.  I took routes that would allow me to reveal as many black blocks as possible in the least amount of steps.	 This was interesting and fun. I looked to see if they were making efficient choices. By that I mean the least amount of spaces moved to reveal the largest amount of black squares.
S776069	26/October/2016	0	31	F	7	G	O	37	 This was fun  I figured the exit was the farthest away	 n/a The faster they finished the maze, the smarter they seemed
S781012	26/October/2016	0	31	F	5	G	O	77	 Fun game  Just relied on a gut feeling, now real way to tell which direction was the correct one.	How many moves it took to reach red circle
S78642	26/October/2016	0	51	F	2	G	O	95	 Fun but frustrating :o)  Gut instinct	 Thank you! If they made less moves overall
S795207	28/October/2016	0	29	F	7	P	P	93	 This was fun. Thanks!  I tried to think about the probability that the red square would be in certain areas and went for that route. Sometimes I was wrong, and sometimes I was right.	 n/a If they made unnecessary movements, I judged them as less intelligent. If they looked at the probability of a certain route, I rated them as higher intelligence.
S818256	26/October/2016	0	30	M	6	P	P	81	 I cleared out as much black area as possible at first so that I would not have to go back and check areas that were not cleared (at least not as much).	 n/a Whether the path was retraced more often than necessary
S826168	26/October/2016	0	28	M	5	P	O	79	 none  I based them off how many the average steps it would take to get to the red door.	 n/a by how many steps it took them to find the door.
S852951	26/October/2016	0	40	F	2	P	P	89	 I just tried to go to areas where I could uncover the most black squares at the same time.	 n/a I determined if the path they took was the most efficient in uncovering the black squares.
S854503	21/October/2016	0	30	F	3	P	P	41	I try to clear the most black squares in the fewest moves as possible so i don't have to move backwards. 	 If they went back over their same tracks and if they checked all the black areas before moving on to a different section
S858712	26/October/2016	0	26	M	2	P	P	14	 At first i decided to check the last place i thought it would be but that seemed to be wrong almost every time. Then i tried to check the first place id think it would be and it was right more often.	Based on shortest route to a possibility. If its 2 blocks to check an area and you go 5 blocks to check an area even its it was in that area it was not a smart move.     
S882638	28/October/2016	0	27	M	3	P	P	56	 tried to view as many black spots with my movements so i could see if the exit was there	 based on the smartest movements ie uncovering the most blocks with the smallest amount of movements, finding the exit on bad moves is luck not intelligence
S890803	26/October/2016	0	35	M	2	P	?	13	 I tried to check the closest spots first and go from their	 Thx for study On how many extra steps they did not have to make
S896860	26/October/2016	1	25	M	6	?	?	74	 Went to the end as best possible	 n/a I'm pretty smart
S898785	26/October/2016	0	36	M	6	P	P	83	 fun game, I enjoyed it.  I thought about the best path to take and how I could rule out as many spots as possible.	 n/a If they made logical and correct assumptions and searches, I found them to be intelligent.
S913185	21/October/2016	0	33	M	6	P	P	36	 Just trying to explore as much as possible in the shortest routes. Assuming the exit is equally likely among all the black squares. 	 To see if they tried to explore as quickly as possible, and reduce the worst case scenarios. The red exit didn't exactly have an equal chance of appearing at any black space.
S926415	21/October/2016	0	45	M	9	G	P	99	 I went to the first available black space first, and then pretty much guessed. 	Whether the person moved toward the most probable location on the mazes; whether s/he corrected quickly
S932984	26/October/2016	0	41	F	6	P	P	96	 I tried to look for options first that would need the least moves to get there.	 n/a If the person went to spaces that they didn't need to, I rated less
S934665	26/October/2016	0	36	F	6	?	?	NA	I made my decisions intuitively ad also based on what I thought was the most logical way out.	 Thanks so much for the study! How logical and deliberate the person was as far as directing the smiley face through the maze.
S94248	26/October/2016	0	30	M	3	P	P	7	 Thanks.  I tried to uncover as many black spaces as I could with as few clicks as possible, but it didn't always work.	 Thanks. If they used as few steps as possible to reveal the most black spaces, they got high marks.
S952115	28/October/2016	0	36	F	6	G	O	79	 I knew the red square could be anywhere so I just took my best guess and went with my gut instinct.	 n/a People that took knowingly unnecessary moves received a one or two. People that seemed to go straight to the red dot without wasting any extra moves, received a 4, even though it may have just been luck. Everyone else received a 3.
S97579	28/October/2016	0	29	F	6	P	P	54	 Interesting study!  I tried to find the route that would get rid of as many black square in as few steps as possible	 Very frustrating that the puzzles moved so slowly! By how efficiently they moved
S976844	26/October/2016	0	31	F	3	G	O	20	 That was fun. I really enjoyed it.  I just took some guesses	 n/a Just how many moves it took them and if it was only shown partially I would always put 3.
S981207	26/October/2016	0	31	F	5	P	P	79	 tried to head to areas with more squares/where it was more likely the exit was located	 n/a if they followed the paths that I would have taken I guess... heading to areas with more squares and shorter distances
S983016	28/October/2016	0	32	M	6	P	P	100	 I tried to uncover as many of the black boxes with as little movement as possible.  After that I just kind of guessed where I thought it might be.	 n/a By the choices that they made and the route they took.  If they went to spaces that didn't get them closer to finding the red dot I marked them down points.
S983809	26/October/2016	0	26	M	6	G	?	42	 Intuition	 n/a if it went against common sense, it was not intelligent.
S989739	26/October/2016	0	30	M	6	G	P	88	I really didn't make a choice. I just chose a side and random and hoped it worked out.	 n/a I just went with how efficient a bot seemed. Some took less optimal paths, or reworked illuminated squares, so they got rated lower.
S990120	26/October/2016	0	25	F	3	G	O	99	 I just kind of went randomly down the mazes and guessed which direction the red square would be.	 n/a Based on how many times some had to backtrack when they passed by certain points in the maze.
S994778	26/October/2016	0	39	M	6	G	?	95	 Good game,no problems.  I took my best guess.	 Good study. I based it on how the moved were taken and if unnecessary moves were made.
